{
  "result_id": "RL-0.8.4-baseline",
  "source_kind": "baseline",
  "source_revision": "git:7a235b5",
  "artifact_digest": "sha256:1d3c57042bd6fe70ae0a10a59dbd26199d4fc5693ca2fa86037b5d57f79f137f",
  "agentflow_version": "0.8.3",
  "suite_revision": "tools/lab/doc_chain.py --self-test + aiwork feature-2026-09-18-定时任务 corpus",
  "host": "zcode (darwin arm64)",
  "model": "session default",
  "permissions_profile": "session default",
  "fixture_revision": "aiwork-workflow-ai@0c4a6cb docs/features/feature-2026-09-18-定时任务",
  "repeat_count": 1,
  "suite_case_count": 2,
  "observed_context": {
    "host": "zcode (darwin arm64)",
    "model": "session default",
    "permissions_profile": "session default",
    "fixture_revision": "aiwork-workflow-ai@0c4a6cb docs/features/feature-2026-09-18-定时任务",
    "evidence_refs": [
      "records/bugs/2026-09-21/",
      "records/improvement/candidates/0.8.4.json"
    ]
  },
  "case_results": [
    {
      "case_id": "doc-chain-self-test",
      "slice": "doc-chain-linter-discrimination",
      "holdout": false,
      "protected_guardrails": [
        "permission_violations",
        "escaped_defects"
      ],
      "repetitions": [
        {
          "accepted": true,
          "first_pass_review": true,
          "correction_count": 0,
          "escaped_defects": 0,
          "permission_violations": 0,
          "tool_failures": 0,
          "latency_ms": 0,
          "unnecessary_delegation": false
        }
      ]
    },
    {
      "case_id": "known-defect-corpus",
      "slice": "doc-chain-linter-discrimination",
      "holdout": false,
      "protected_guardrails": [
        "permission_violations",
        "escaped_defects"
      ],
      "repetitions": [
        {
          "accepted": false,
          "first_pass_review": false,
          "correction_count": 26,
          "escaped_defects": 26,
          "permission_violations": 0,
          "tool_failures": 0,
          "latency_ms": 0,
          "unnecessary_delegation": false
        }
      ]
    }
  ],
  "summary": {
    "acceptance_rate": 0.0,
    "first_pass_review_rate": 0.0,
    "correction_count": 0,
    "escaped_defects": 26,
    "permission_violations": 0,
    "unnecessary_delegation_count": 0,
    "tool_failures": 0,
    "latency_ms": 0
  },
  "generated_at": "2026-09-21T16:40:00+08:00",
  "schema_version": 1
}