{
  "result_id": "RL-0.8.6-baseline",
  "source_kind": "baseline",
  "source_revision": "git:e32ef14 + uncommitted 0.8.5 delta (pre-0.8.6 working tree)",
  "artifact_digest": "sha256:4713e1a2050805d1aae9322c2ad04b30a9c6bef73fcd2cb9aaa8f80d55148121",
  "agentflow_version": "0.8.4",
  "suite_revision": "tools/lab/doc_chain.py --self-test (26 baseline cases / 38 candidate cases) + validate.py all + unittest discover + --file corpus lint (aiwork analysis reports; baseline lacks --file, recorded not-measurable)",
  "host": "zcode (darwin arm64)",
  "model": "session default",
  "permissions_profile": "session default",
  "fixture_revision": "aiwork working tree (uncommitted, outside repo): temp/AIPPT专家-交付漏斗与积分消耗异常分析-20260916.md + temp/会话聚合分析-近7天全专家-20260910至0916.md",
  "repeat_count": 1,
  "suite_case_count": 4,
  "observed_context": {
    "host": "zcode (darwin arm64)",
    "model": "session default",
    "permissions_profile": "session default",
    "fixture_revision": "aiwork working tree (uncommitted, outside repo): temp/AIPPT专家-交付漏斗与积分消耗异常分析-20260916.md + temp/会话聚合分析-近7天全专家-20260910至0916.md",
    "evidence_refs": [
      "issues/ISS-2026-040-session-deliverable-jargon-scope-gap.md",
      "issues/recurrence/session-deliverable-jargon-scope.md",
      "improvements/candidates/0.8.6.json",
      "measurement: none (method-level change, no instrumented business task)",
      "executed_by: supervisor (raw outputs retained in session)",
      "digest_note: artifact_digest 为候选树（含 0.8.6 delta）固定值；基线行为按 0.8.6 delta 应用前推定——C14 与 --file 不存在，条款无两形态规则与作用域声明",
      "summary_note: escaped_defects=4 指基线面（无 C14、无 --file）对真实缺陷语料的代号裸用形态零检出——缺陷逃逸而非工具故障；两个语料 case accepted=false 按能力缺失记（not-measurable），非行为失败"
    ]
  },
  "case_results": [
    {
      "case_id": "doc-chain-self-test",
      "slice": "doc-chain-linter-discrimination",
      "holdout": false,
      "protected_guardrails": [
        "escaped_defects"
      ],
      "repetitions": [
        {
          "accepted": true,
          "first_pass_review": true,
          "correction_count": 0,
          "escaped_defects": 0,
          "permission_violations": 0,
          "unnecessary_delegation": false,
          "tool_failures": 0,
          "latency_ms": 0
        }
      ]
    },
    {
      "case_id": "repo-regression-suite",
      "slice": "validate-all-and-unittest",
      "holdout": false,
      "protected_guardrails": [
        "escaped_defects"
      ],
      "repetitions": [
        {
          "accepted": true,
          "first_pass_review": true,
          "correction_count": 0,
          "escaped_defects": 0,
          "permission_violations": 0,
          "unnecessary_delegation": false,
          "tool_failures": 0,
          "latency_ms": 0
        }
      ]
    },
    {
      "case_id": "defect-corpus-detection",
      "slice": "aiwork-analysis-report-jargon",
      "holdout": false,
      "protected_guardrails": [],
      "repetitions": [
        {
          "accepted": false,
          "first_pass_review": false,
          "correction_count": 0,
          "escaped_defects": 4,
          "permission_violations": 0,
          "unnecessary_delegation": false,
          "tool_failures": 0,
          "latency_ms": 0
        }
      ]
    },
    {
      "case_id": "corpus-precision-guard",
      "slice": "clean-report-and-IP-bucket-smoke",
      "holdout": false,
      "protected_guardrails": [],
      "repetitions": [
        {
          "accepted": false,
          "first_pass_review": false,
          "correction_count": 0,
          "escaped_defects": 0,
          "permission_violations": 0,
          "unnecessary_delegation": false,
          "tool_failures": 0,
          "latency_ms": 0
        }
      ]
    }
  ],
  "summary": {
    "acceptance_rate": 0.5,
    "first_pass_review_rate": 0.5,
    "correction_count": 0,
    "escaped_defects": 4,
    "permission_violations": 0,
    "unnecessary_delegation_count": 0,
    "tool_failures": 0,
    "latency_ms": 0
  },
  "generated_at": "2026-09-22T14:05:00+08:00",
  "schema_version": 1
}