{
  "result_id": "RL-0.8.4-candidate",
  "source_kind": "candidate",
  "source_revision": "git:7a235b5+candidate-0.8.4 (uncommitted)",
  "artifact_digest": "sha256:7b68f5bd3faa93f792d3b8446b79d38b1951d84a61a181d9a5accec4d1a6b7c1",
  "agentflow_version": "0.8.4",
  "suite_revision": "tools/lab/doc_chain.py --self-test + aiwork feature-2026-09-18-定时任务 corpus",
  "host": "zcode (darwin arm64)",
  "model": "session default",
  "permissions_profile": "session default",
  "fixture_revision": "aiwork-workflow-ai@0c4a6cb docs/features/feature-2026-09-18-定时任务",
  "repeat_count": 1,
  "suite_case_count": 2,
  "observed_context": {
    "host": "zcode (darwin arm64)",
    "model": "session default",
    "permissions_profile": "session default",
    "fixture_revision": "aiwork-workflow-ai@0c4a6cb docs/features/feature-2026-09-18-定时任务",
    "evidence_refs": [
      "issues/ISS-2026-035~039",
      "improvements/candidates/0.8.4.json"
    ]
  },
  "case_results": [
    {
      "case_id": "doc-chain-self-test",
      "slice": "doc-chain-linter-discrimination",
      "holdout": false,
      "protected_guardrails": [
        "permission_violations",
        "escaped_defects"
      ],
      "repetitions": [
        {
          "accepted": true,
          "first_pass_review": true,
          "correction_count": 0,
          "escaped_defects": 0,
          "permission_violations": 0,
          "tool_failures": 0,
          "latency_ms": 0,
          "unnecessary_delegation": false
        }
      ]
    },
    {
      "case_id": "known-defect-corpus",
      "slice": "doc-chain-linter-discrimination",
      "holdout": false,
      "protected_guardrails": [
        "permission_violations",
        "escaped_defects"
      ],
      "repetitions": [
        {
          "accepted": true,
          "first_pass_review": true,
          "correction_count": 0,
          "escaped_defects": 0,
          "permission_violations": 0,
          "tool_failures": 0,
          "latency_ms": 0,
          "unnecessary_delegation": false
        }
      ]
    }
  ],
  "summary": {
    "acceptance_rate": 1.0,
    "first_pass_review_rate": 1.0,
    "correction_count": 2,
    "escaped_defects": 0,
    "permission_violations": 0,
    "unnecessary_delegation_count": 0,
    "tool_failures": 0,
    "latency_ms": 0
  },
  "generated_at": "2026-09-21T16:40:00+08:00",
  "schema_version": 1
}