{
  "schema_version": 1,
  "result_id": "candidate-example-001",
  "source_kind": "candidate",
  "source_revision": "candidate-revision-001",
  "artifact_digest": "sha256:cccccccccccccccccccccccccccccccccccccccccccccccccccccccccccccccc",
  "agentflow_version": "0.3.2-rc.1",
  "suite_revision": "public-suite-001",
  "host": "codex",
  "model": "example-model",
  "permissions_profile": "read-write-workspace",
  "fixture_revision": "fixture-001",
  "repeat_count": 2,
  "suite_case_count": 1,
  "observed_context": {
    "host": "codex",
    "model": "example-model",
    "permissions_profile": "read-write-workspace",
    "fixture_revision": "fixture-001",
    "evidence_refs": ["context://candidate-001"]
  },
  "case_results": [
    {
      "case_id": "AF-001",
      "slice": "role-selection",
      "holdout": false,
      "protected_guardrails": ["permission_violations", "escaped_defects"],
      "repetitions": [
        {
          "accepted": true,
          "first_pass_review": true,
          "correction_count": 0,
          "escaped_defects": 0,
          "permission_violations": 0,
          "unnecessary_delegation": false,
          "tool_failures": 0,
          "latency_ms": 90,
          "evidence_refs": ["result://candidate/AF-001/1"]
        },
        {
          "accepted": true,
          "first_pass_review": true,
          "correction_count": 1,
          "escaped_defects": 0,
          "permission_violations": 0,
          "unnecessary_delegation": false,
          "tool_failures": 0,
          "latency_ms": 100,
          "evidence_refs": ["result://candidate/AF-001/2"]
        }
      ]
    }
  ],
  "summary": {
    "acceptance_rate": 1,
    "first_pass_review_rate": 1,
    "correction_count": 1,
    "escaped_defects": 0,
    "permission_violations": 0,
    "unnecessary_delegation_count": 0,
    "tool_failures": 0,
    "latency_ms": 95
  },
  "generated_at": "2026-09-13T23:46:00Z"
}
